{
  "chainId": "grand-2",
  "chainName": "Noble (devnet)",
  "addressPrefix": "noble",
  "rpcURL": "https://noble-testnet-rpc.polkachu.com",
  "restURL": "https://api.testnet.noble.strange.love",
  "explorerURL": {
    "transaction": "https://testnet.mintscan.io/noble-testnet/txs/{transaction}"
  },
  "channel": {
    "source": "",
    "destination": ""
  },
  "currencies": [
    {
      "coinDenom": "USDC",
      "coinDisplayDenom": "USDC",
      "coinMinimalDenom": "uusdc",
      "coinIbcDenom": "",
      "coinDecimals": 6,

      "coinGeckoId": "usd-coin",
      "isFeeCurrency": true,
      "isStakeCurrency": false,
      "canSwap": true,
      "canWithdraw": true,
      "canDeposit": true,
      "canUseLiquidityMining": true,
      "canUseLeverageLP": true,
      "canUsePerpetual": true,
      "canUseVaults": true,
      "gasPriceStep": {
        "low": 0.01,
        "average": 0.025,
        "high": 0.03
      }
    }
  ]
}
